{
  "schema_version": 1,
  "kind": "api.call",
  "data": {
    "function": "core_webservice_get_site_info",
    "params": {},
    "response": {
      "sitename": "Dockerized_Moodle",
      "username": "student1",
      "firstname": "Sam",
      "lastname": "Student",
      "fullname": "Sam Student",
      "lang": "en",
      "userid": 4,
      "siteurl": "http:\/\/localhost:8511",
      "userpictureurl": "http:\/\/localhost:8511\/theme\/image.php\/boost\/core\/1789793290\/u\/f1",
      "functions": [
        {
          "name": "core_badges_get_badge",
          "version": "2025100607"
        },
        {
          "name": "core_badges_get_user_badges",
          "version": "2025100607"
        },
        {
          "name": "core_badges_get_user_badge_by_hash",
          "version": "2025100607"
        },
        {
          "name": "core_blog_get_entries",
          "version": "2025100607"
        },
        {
          "name": "core_blog_view_entries",
          "version": "2025100607"
        },
        {
          "name": "core_blog_get_access_information",
          "version": "2025100607"
        },
        {
          "name": "core_blog_add_entry",
          "version": "2025100607"
        },
        {
          "name": "core_blog_delete_entry",
          "version": "2025100607"
        },
        {
          "name": "core_blog_prepare_entry_for_edition",
          "version": "2025100607"
        },
        {
          "name": "core_blog_update_entry",
          "version": "2025100607"
        },
        {
          "name": "core_calendar_get_calendar_monthly_view",
          "version": "2025100607"
        },
        {
          "name": "core_calendar_get_calendar_day_view",
          "version": "2025100607"
        },
        {
          "name": "core_calendar_get_calendar_upcoming_view",
          "version": "2025100607"
        },
        {
          "name": "core_calendar_update_event_start_day",
          "version": "2025100607"
        },
        {
          "name": "core_calendar_create_calendar_events",
          "version": "2025100607"
        },
        {
          "name": "core_calendar_delete_calendar_events",
          "version": "2025100607"
        },
        {
          "name": "core_calendar_get_calendar_events",
          "version": "2025100607"
        },
        {
          "name": "core_calendar_get_action_events_by_timesort",
          "version": "2025100607"
        },
        {
          "name": "core_calendar_get_action_events_by_course",
          "version": "2025100607"
        },
        {
          "name": "core_calendar_get_action_events_by_courses",
          "version": "2025100607"
        },
        {
          "name": "core_calendar_get_calendar_event_by_id",
          "version": "2025100607"
        },
        {
          "name": "core_calendar_submit_create_update_form",
          "version": "2025100607"
        },
        {
          "name": "core_calendar_get_calendar_access_information",
          "version": "2025100607"
        },
        {
          "name": "core_calendar_get_allowed_event_types",
          "version": "2025100607"
        },
        {
          "name": "core_calendar_get_calendar_export_token",
          "version": "2025100607"
        },
        {
          "name": "core_comment_get_comments",
          "version": "2025100607"
        },
        {
          "name": "core_comment_add_comments",
          "version": "2025100607"
        },
        {
          "name": "core_comment_delete_comments",
          "version": "2025100607"
        },
        {
          "name": "core_completion_get_activities_completion_status",
          "version": "2025100607"
        },
        {
          "name": "core_completion_get_course_completion_status",
          "version": "2025100607"
        },
        {
          "name": "core_completion_mark_course_self_completed",
          "version": "2025100607"
        },
        {
          "name": "core_completion_update_activity_completion_status_manually",
          "version": "2025100607"
        },
        {
          "name": "core_course_get_categories",
          "version": "2025100607"
        },
        {
          "name": "core_course_get_contents",
          "version": "2025100607"
        },
        {
          "name": "core_course_get_course_module",
          "version": "2025100607"
        },
        {
          "name": "core_course_get_course_module_by_instance",
          "version": "2025100607"
        },
        {
          "name": "core_courseformat_get_overview_information",
          "version": "2025100607"
        },
        {
          "name": "core_courseformat_log_view_overview_information",
          "version": "2025100607"
        },
        {
          "name": "core_course_get_courses",
          "version": "2025100607"
        },
        {
          "name": "core_course_search_courses",
          "version": "2025100607"
        },
        {
          "name": "core_course_view_course",
          "version": "2025100607"
        },
        {
          "name": "core_course_get_user_navigation_options",
          "version": "2025100607"
        },
        {
          "name": "core_course_get_user_administration_options",
          "version": "2025100607"
        },
        {
          "name": "core_course_get_courses_by_field",
          "version": "2025100607"
        },
        {
          "name": "core_course_check_updates",
          "version": "2025100607"
        },
        {
          "name": "core_course_get_updates_since",
          "version": "2025100607"
        },
        {
          "name": "core_course_get_enrolled_courses_by_timeline_classification",
          "version": "2025100607"
        },
        {
          "name": "core_course_get_enrolled_courses_with_action_events_by_timeline_classification",
          "version": "2025100607"
        },
        {
          "name": "core_course_get_recent_courses",
          "version": "2025100607"
        },
        {
          "name": "core_course_set_favourite_courses",
          "version": "2025100607"
        },
        {
          "name": "core_course_view_module_instance_list",
          "version": "2025100607"
        },
        {
          "name": "core_enrol_get_course_enrolment_methods",
          "version": "2025100607"
        },
        {
          "name": "core_enrol_get_enrolled_users",
          "version": "2025100607"
        },
        {
          "name": "core_enrol_search_users",
          "version": "2025100607"
        },
        {
          "name": "core_enrol_get_users_courses",
          "version": "2025100607"
        },
        {
          "name": "core_files_get_files",
          "version": "2025100607"
        },
        {
          "name": "core_files_delete_draft_files",
          "version": "2025100607"
        },
        {
          "name": "core_files_get_unused_draft_itemid",
          "version": "2025100607"
        },
        {
          "name": "core_get_component_strings",
          "version": "2025100607"
        },
        {
          "name": "core_grades_grader_gradingpanel_point_fetch",
          "version": "2025100607"
        },
        {
          "name": "core_grades_grader_gradingpanel_point_store",
          "version": "2025100607"
        },
        {
          "name": "core_grades_grader_gradingpanel_scale_fetch",
          "version": "2025100607"
        },
        {
          "name": "core_grades_grader_gradingpanel_scale_store",
          "version": "2025100607"
        },
        {
          "name": "core_grades_get_enrolled_users_for_selector",
          "version": "2025100607"
        },
        {
          "name": "core_grades_get_groups_for_selector",
          "version": "2025100607"
        },
        {
          "name": "core_grades_get_gradeitems",
          "version": "2025100607"
        },
        {
          "name": "core_grades_get_gradable_users",
          "version": "2025100607"
        },
        {
          "name": "core_group_get_activity_allowed_groups",
          "version": "2025100607"
        },
        {
          "name": "core_group_get_activity_groupmode",
          "version": "2025100607"
        },
        {
          "name": "core_group_get_course_groupings",
          "version": "2025100607"
        },
        {
          "name": "core_group_get_course_groups",
          "version": "2025100607"
        },
        {
          "name": "core_group_get_course_user_groups",
          "version": "2025100607"
        },
        {
          "name": "core_group_get_groups_for_selector",
          "version": "2025100607"
        },
        {
          "name": "core_message_mute_conversations",
          "version": "2025100607"
        },
        {
          "name": "core_message_unmute_conversations",
          "version": "2025100607"
        },
        {
          "name": "core_message_block_user",
          "version": "2025100607"
        },
        {
          "name": "core_message_get_contact_requests",
          "version": "2025100607"
        },
        {
          "name": "core_message_create_contact_request",
          "version": "2025100607"
        },
        {
          "name": "core_message_confirm_contact_request",
          "version": "2025100607"
        },
        {
          "name": "core_message_decline_contact_request",
          "version": "2025100607"
        },
        {
          "name": "core_message_get_received_contact_requests_count",
          "version": "2025100607"
        },
        {
          "name": "core_message_delete_contacts",
          "version": "2025100607"
        },
        {
          "name": "core_message_delete_conversations_by_id",
          "version": "2025100607"
        },
        {
          "name": "core_message_delete_message",
          "version": "2025100607"
        },
        {
          "name": "core_message_get_blocked_users",
          "version": "2025100607"
        },
        {